<?xml version="1.0" encoding="UTF-8" ?>
<xs:schema xmlns:xs="http://www.w3.org/2001/XMLSchema" elementFormDefault="qualified" attributeFormDefault="unqualified">
<xs:element name="posts">
  <xs:complexType>
    <xs:sequence>
      <xs:element name="post" maxOccurs="unbounded">
        <xs:complexType>
          <xs:sequence>
            <xs:element name="title" type="xs:string"></xs:element>
            <xs:element name="body" type="xs:string"></xs:element>
            <xs:element name="published_at" type="xs:dateTime"></xs:element>
            <xs:element name="author" type="xs:string"></xs:element>
            <xs:element name="files">
              <xs:complexType>
                <xs:sequence>
                  <xs:element name="image" maxOccurs="unbounded">
                    <xs:complexType>
                      <xs:sequence>
                        <xs:element name="name" type="xs:string"></xs:element>
                        </xs:sequence>
                      </xs:complexType>
                    </xs:element>
                  <xs:element name="audio" maxOccurs="unbounded">
                    <xs:complexType>
                      <xs:sequence>
                        <xs:element name="name" type="xs:string"></xs:element>
                        </xs:sequence>
                      </xs:complexType>
                    </xs:element>
                  </xs:sequence>
                </xs:complexType>
              </xs:element>
            <xs:element name="tags">
              <xs:complexType>
                <xs:sequence>
                  <xs:element name="tag" maxOccurs="unbounded">
                    <xs:complexType>
                      <xs:sequence>
                        <xs:element name="name" type="xs:string"></xs:element>
                        </xs:sequence>
                      </xs:complexType>
                    </xs:element>
                  </xs:sequence>
                </xs:complexType>
              </xs:element>
            <xs:element name="comments">
              <xs:complexType>
                <xs:sequence>
                  <xs:element name="comment" maxOccurs="unbounded">
                    <xs:complexType>
                      <xs:sequence>
                        <xs:element name="text" type="xs:string"></xs:element>
                        <xs:element name="author" type="xs:string"></xs:element>
                        <xs:element name="published_at" type="xs:dateTime"></xs:element>
                        </xs:sequence>
                      </xs:complexType>
                    </xs:element>
                  </xs:sequence>
                </xs:complexType>
              </xs:element>
            </xs:sequence>
          </xs:complexType>
        </xs:element>
      </xs:sequence>
    </xs:complexType>
  </xs:element>
</xs:schema>
